{
  "schema_version": "1.0",
  "source": "reference/original-static-page.html",
  "note": "영업시간·휴무는 원본이 밝힌 근사치다(가정 A1). 정확성을 보증하지 않으며 사용자가 편집한다(REQ-004). hours_text·closed_text 는 원문 문자열 그대로이며 파싱은 런타임에 domain/hours.py 가 한다.",
  "days": [
    {
      "day_index": 1,
      "label": "10.5 월",
      "title": "도착 + 침사추이 하버뷰",
      "area": "구룡(TST)",
      "color": "#22d3ee",
      "start_local": "14:00",
      "spots": [
        {
          "time_label": "오후",
          "name": "스타 애비뉴",
          "name_original": "Avenue of Stars",
          "tip": "빅토리아 하버 산책로. 이소룡 동상·스타 핸드프린트.",
          "hours_text": "야외 상시 (24h)",
          "closed_text": "",
          "description": "하버를 따라 이어진 산책로로 홍콩 영화의 전설들을 기념하는 공간. 침사추이 도착 첫 코스로 좋다.",
          "recommendation": "이소룡 동상 인증샷, 밤 8시 심포니 오브 라이트 관람 명당.",
          "lat": 22.2937,
          "lng": 114.173,
          "dwell_minutes": null
        },
        {
          "time_label": "오후",
          "name": "시계탑",
          "name_original": "Clock Tower",
          "tip": "1915년 옛 구룡역 붉은 벽돌 시계탑.",
          "hours_text": "야외 상시",
          "closed_text": "",
          "description": "철거된 구 구룡-광저우 철도역의 유일한 잔존물로 TST의 랜드마크.",
          "recommendation": "해질녘 하버·문화센터 배경 사진.",
          "lat": 22.2937,
          "lng": 114.1687,
          "dwell_minutes": null
        },
        {
          "time_label": "오후",
          "name": "스타페리",
          "name_original": "Star Ferry (TST→Central)",
          "tip": "1888년부터 운행한 명물 페리.",
          "hours_text": "매일 06:30–23:30경 · 6~10분 간격",
          "closed_text": "",
          "description": "저렴하게 빅토리아 하버를 건너는 클래식한 방법. 홍콩섬 이동과 관광을 동시에.",
          "recommendation": "상층 데크에서 스카이라인 감상, 옥토퍼스로 탑승(약 HK$5).",
          "lat": 22.2935,
          "lng": 114.1685,
          "dwell_minutes": null
        },
        {
          "time_label": "저녁",
          "name": "하버시티 / K11 MUSEA",
          "name_original": "쇼핑·다이닝",
          "tip": "대형 쇼핑몰 + 아트 테마 몰.",
          "hours_text": "대체로 매일 10:00–22:00",
          "closed_text": "",
          "description": "TST 최대 쇼핑몰 하버시티와 예술을 접목한 K11 MUSEA. 저녁 식사와 쇼핑을 한 번에.",
          "recommendation": "K11 MUSEA 옥상정원·포토존, 하버시티 내 딤섬·로컬 맛집.",
          "lat": 22.2939,
          "lng": 114.174,
          "dwell_minutes": null
        },
        {
          "time_label": "20:00",
          "name": "심포니 오브 라이트",
          "name_original": "Symphony of Lights",
          "tip": "하버 양안 빌딩의 조명·레이저 쇼.",
          "hours_text": "매일 20:00 시작 · 약 10~13분",
          "closed_text": "",
          "description": "기네스 등재 상설 조명쇼. 40여 개 빌딩이 음악에 맞춰 빛난다.",
          "recommendation": "침사추이 프롬나드 또는 스타페리 위에서 관람. 8시 15분 전 자리잡기.",
          "lat": 22.2934,
          "lng": 114.172,
          "dwell_minutes": null
        },
        {
          "time_label": "밤",
          "name": "템플 스트리트 야시장",
          "name_original": "Temple St Night Market",
          "tip": "야우마테이 대표 야시장(여력 시).",
          "hours_text": "매일 대략 18:00–24:00",
          "closed_text": "",
          "description": "노점·먹거리·점집이 늘어선 홍콩의 상징적 야시장. 저녁부터 활기를 띤다.",
          "recommendation": "해산물 볶음·꼬치, 노천 다이파이동 분위기 즐기기.",
          "lat": 22.307,
          "lng": 114.1701,
          "dwell_minutes": null
        }
      ]
    },
    {
      "day_index": 2,
      "label": "10.6 화",
      "title": "홍콩섬 — 센트럴·남부·피크",
      "area": "Hong Kong Island",
      "color": "#ff2e88",
      "start_local": "09:00",
      "spots": [
        {
          "time_label": "오전",
          "name": "만모사원",
          "name_original": "Man Mo Temple",
          "tip": "문(학문)·무(무예)의 신을 모신 도교 사원.",
          "hours_text": "매일 08:00–18:00 · 무료",
          "closed_text": "",
          "description": "1847년경 세운 사원으로 천장 가득한 소용돌이 향이 인상적. 성완 헤리티지 코스의 시작점.",
          "recommendation": "소용돌이 향 아래 사진(조용히·정숙). 근처 캣스트리트 골동품 거리.",
          "lat": 22.2838,
          "lng": 114.1503,
          "dwell_minutes": null
        },
        {
          "time_label": "오전",
          "name": "PMQ",
          "name_original": "元創方",
          "tip": "옛 경찰 기숙사를 개조한 디자인·공예 단지.",
          "hours_text": "단지 상시 · 상점 대략 11:00–20:00",
          "closed_text": "",
          "description": "로컬 디자이너와 공예가들의 스튜디오·편집숍이 모인 창작 공간.",
          "recommendation": "독립 디자이너 숍·팝업 구경, 안뜰 카페.",
          "lat": 22.2836,
          "lng": 114.1512,
          "dwell_minutes": null
        },
        {
          "time_label": "오전",
          "name": "타이쿤",
          "name_original": "Tai Kwun 大館",
          "tip": "옛 경찰서·감옥·법원 개조 예술문화 공간.",
          "hours_text": "매일 10:00–23:00 (갤러리 화~일 11:00–19:00)",
          "closed_text": "일부 갤러리 월요일",
          "description": "식민지 시대 중앙경찰서·빅토리아 감옥을 복원한 복합문화공간. 역사와 현대미술이 공존.",
          "recommendation": "감옥동 무료 관람, 현대미술 갤러리, 안뜰 바·레스토랑.",
          "lat": 22.2818,
          "lng": 114.1547,
          "dwell_minutes": null
        },
        {
          "time_label": "오전",
          "name": "미드레벨 에스컬레이터",
          "name_original": "세계 최장 옥외 에스컬레이터",
          "tip": "소호를 관통하는 명물 에스컬레이터.",
          "hours_text": "하행 06:00–10:00 / 상행 10:00–24:00",
          "closed_text": "",
          "description": "800m 길이의 세계 최장 옥외 에스컬레이터. 언덕 위 소호 골목으로 이어진다.",
          "recommendation": "오르내리며 소호 골목의 카페·바·벽화 탐방.",
          "lat": 22.2828,
          "lng": 114.1552,
          "dwell_minutes": null
        },
        {
          "time_label": "점심후",
          "name": "스탠리 마켓",
          "name_original": "Stanley Market",
          "tip": "홍콩섬 남단 해안마을 노천 시장.",
          "hours_text": "대체로 매일 10:00–18:00",
          "closed_text": "",
          "description": "실크·기념품·의류 노점이 모인 해변 마을. Exchange Sq에서 6/6X/260 버스로 이동.",
          "recommendation": "머레이 하우스·해변 산책로, 기념품 쇼핑.",
          "lat": 22.2188,
          "lng": 114.213,
          "dwell_minutes": null
        },
        {
          "time_label": "오후",
          "name": "리펄스 베이",
          "name_original": "Repulse Bay",
          "tip": "완만한 백사장과 톈허우 사원.",
          "hours_text": "야외 상시",
          "closed_text": "",
          "description": "홍콩 남부의 대표 해변. 스탠리 오가는 길에 들르기 좋다.",
          "recommendation": "해변 산책, 사원 앞 소원의 다리·수관음상.",
          "lat": 22.236,
          "lng": 114.1965,
          "dwell_minutes": null
        },
        {
          "time_label": "일몰",
          "name": "피크트램 승차",
          "name_original": "Peak Tram (Garden Rd)",
          "tip": "1888년 개통한 급경사 푸니쿨라.",
          "hours_text": "매일 07:30–23:00",
          "closed_text": "",
          "description": "6세대 유리천장 트램으로 빅토리아 피크까지 오르는 명물. 가든로드 하부역에서 탑승.",
          "recommendation": "온라인 예약 + 앞쪽 우측 좌석. 오르막에 건물이 기우는 착시가 압권.",
          "lat": 22.2777,
          "lng": 114.16,
          "dwell_minutes": null
        },
        {
          "time_label": "야경",
          "name": "빅토리아 피크",
          "name_original": "Sky Terrace 428",
          "tip": "해발 428m, 홍콩 최고의 야경 전망대.",
          "hours_text": "매일 08:30–22:00",
          "closed_text": "",
          "description": "홍콩 최고 높이의 옥외 전망대. 낮과 밤 모두 하버 전경이 장관.",
          "recommendation": "일몰~야경 타이밍이 베스트. 무료 뷰는 피크 갤러리아 옥상·라이언스 파빌리온.",
          "lat": 22.2759,
          "lng": 114.1455,
          "dwell_minutes": null
        },
        {
          "time_label": "저녁",
          "name": "란콰이퐁 / 소호",
          "name_original": "Lan Kwai Fong",
          "tip": "센트럴 대표 나이트라이프 거리.",
          "hours_text": "저녁~심야",
          "closed_text": "",
          "description": "바·레스토랑이 밀집한 홍콩의 밤 문화 중심지.",
          "recommendation": "하산 후 저녁 식사와 바 홉핑으로 마무리.",
          "lat": 22.2809,
          "lng": 114.1556,
          "dwell_minutes": null
        }
      ]
    },
    {
      "day_index": 3,
      "label": "10.7 수",
      "title": "란타우섬 + 몽콕",
      "area": "Lantau + Mongkok",
      "color": "#f7b733",
      "start_local": "09:00",
      "spots": [
        {
          "time_label": "오전",
          "name": "옹핑360 케이블카",
          "name_original": "Ngong Ping 360",
          "tip": "통청↔옹핑 25분 크리스탈 캐빈.",
          "hours_text": "평일 10:00–18:00 / 주말·공휴일 09:00–18:30",
          "closed_text": "(정비휴무 9/8~18은 여행 전 종료)",
          "description": "5.7km를 잇는 케이블카로 란타우 산·바다 위를 미끄러진다. 10/7 수요일은 평일 운행.",
          "recommendation": "온라인 예약 필수. 크리스탈(투명바닥) 캐빈, 오전 일찍 탑승해 대기 회피.",
          "lat": 22.2926,
          "lng": 113.9418,
          "dwell_minutes": null
        },
        {
          "time_label": "오전",
          "name": "천단대불",
          "name_original": "Big Buddha 天壇大佛",
          "tip": "268계단 위 34m 청동 좌불.",
          "hours_text": "야외 상시 / 내부 대략 10:00–17:30",
          "closed_text": "",
          "description": "란타우의 상징인 대형 청동 좌불. 계단을 오르면 사방 전망이 트인다.",
          "recommendation": "계단 오르기는 무료. 내부·박물관은 포린사원 식사권으로 입장. 물·자외선 대비.",
          "lat": 22.254,
          "lng": 113.905,
          "dwell_minutes": null
        },
        {
          "time_label": "오전",
          "name": "포린사원",
          "name_original": "Po Lin Monastery",
          "tip": "1906년 창건, 홍콩 최대 불교 사원.",
          "hours_text": "매일 09:00–18:00 / 채식당 11:30–16:30",
          "closed_text": "",
          "description": "빅부다 아래 자리한 대형 사원. 지혜의 길(Wisdom Path)은 보수로 폐쇄(2026년말까지).",
          "recommendation": "유명한 채식 세트런치(HK$100~145). 인기라 정오 전 도착 권장.",
          "lat": 22.2545,
          "lng": 113.9061,
          "dwell_minutes": null
        },
        {
          "time_label": "점심",
          "name": "옹핑빌리지",
          "name_original": "Ngong Ping Village",
          "tip": "케이블카 종점의 식당·상점 거리.",
          "hours_text": "대략 10:00–18:00",
          "closed_text": "",
          "description": "테마형 상점가로 식당·카페·기념품점이 모여 있다.",
          "recommendation": "점심 해결에 편리. 시내보다 20~30% 비싼 편이니 참고.",
          "lat": 22.2565,
          "lng": 113.9042,
          "dwell_minutes": null
        },
        {
          "time_label": "오후",
          "name": "타이오 어촌마을",
          "name_original": "Tai O (선택)",
          "tip": "수상가옥으로 유명한 서쪽 어촌.",
          "hours_text": "마을 상시 · 상점은 낮 시간",
          "closed_text": "",
          "description": "란타우 서쪽 끝의 전통 어촌으로 스틸트 하우스(수상가옥)가 명물. 시간 여유 시 방문.",